{
 "schema_version": 1,
 "project": "Velqu / VelquJS",
 "baseline": {
  "archive": "velqu-m0-m2-20260819T093558Z.zip",
  "sha256": "03a06bbdcc7b4f7626dd5b287983c4f3b6d26ff82e4895923284d76af92debb5"
 },
 "status_values": [
  "TODO",
  "IN_PROGRESS",
  "BLOCKED",
  "PASS",
  "FAIL",
  "WAIVED"
 ],
 "milestones": [
  {
   "id": "BASE",
   "name": "Baseline Freeze and Program Integration",
   "outcome": "The current M2.3-r1 baseline, roadmap authority, evidence model, and review packet format are frozen before further code changes.",
   "gate": "BASE-GATE",
   "depends_on": []
  },
  {
   "id": "M23R2",
   "name": "M2.3-r2 — Exact Numeric Runtime IR and Compiled Router Closure",
   "outcome": "Current-pack execution is fully numeric, fail-before-ready, route plans are exact, schema identities are operational, and the router resolves directly to a numeric RoutePlan.",
   "gate": "M23R2-GATE",
   "depends_on": [
    "BASE-GATE"
   ]
  },
  {
   "id": "M24",
   "name": "M2.4 — Zero-Copy Ingress and Worker-Local Request Bridge",
   "outcome": "Requests route before decoding, unread fields are never materialized, and request state is owned by the QuickJS worker without a process-wide request-store mutex.",
   "gate": "M24-GATE",
   "depends_on": [
    "M23R2-GATE"
   ]
  },
  {
   "id": "M25",
   "name": "M2.5 — Schema-Specialized Input and JSON Output Pipeline",
   "outcome": "The compiler selects measured, schema-aware decoders and encoders while maintaining exact Treaty/OpenAPI/runtime semantics.",
   "gate": "M25-GATE",
   "depends_on": [
    "M24-GATE"
   ]
  },
  {
   "id": "M26",
   "name": "M2.6 — Binary QPack v2 and Reproducible Artifact ABI",
   "outcome": "Production startup maps a deterministic binary pack with raw bytecode, precompiled router/runtime IR, strict ABI fingerprinting, and no JSON/base64 reconstruction.",
   "gate": "M26-GATE",
   "depends_on": [
    "M25-GATE"
   ]
  },
  {
   "id": "M27",
   "name": "M2.7 — Capability Linker and Minimal Web Runtime",
   "outcome": "Only declared native capabilities are linked, lifecycle and cancellation are standardized, and a small WinterTC-aligned Web API subset is conformant.",
   "gate": "M27-GATE",
   "depends_on": [
    "M26-GATE"
   ]
  },
  {
   "id": "M28",
   "name": "M2.8 — Native Outbound Fetch",
   "outcome": "Velqu provides bounded, cancellable, pooled Web fetch with TLS/DNS correctness, streaming backpressure, and explicit SSRF policy.",
   "gate": "M28-GATE",
   "depends_on": [
    "M27-GATE"
   ]
  },
  {
   "id": "M3",
   "name": "M3 — Multi-Worker Service Runtime",
   "outcome": "Independent QuickJS workers scale across cores with bounded queues, quarantine/replacement, and distinct serverless/service/throughput profiles.",
   "gate": "M3-GATE",
   "depends_on": [
    "M28-GATE"
   ]
  },
  {
   "id": "M4",
   "name": "M4 — Developer Experience and Private Alpha",
   "outcome": "The actual Rust/QuickJS runtime is pleasant to develop against, Treaty modes are complete, Linux release artifacts exist, and a realistic proof service is private-alpha ready.",
   "gate": "M4-GATE",
   "depends_on": [
    "M3-GATE"
   ]
  },
  {
   "id": "M5",
   "name": "M5 — Production Operations and Real-World Proof",
   "outcome": "Operational controls, observability, optional Postgres integration, executable cross-framework workloads, and a controlled production canary establish technical production candidacy.",
   "gate": "M5-GATE",
   "depends_on": [
    "M4-GATE"
   ]
  },
  {
   "id": "M6",
   "name": "M6 — Security, Reliability, Platform, and Supply-Chain Hardening",
   "outcome": "The runtime passes fuzzing, sanitizers, chaos, soak, supported-platform, vulnerability, reproducibility, and artifact-integrity gates.",
   "gate": "M6-GATE",
   "depends_on": [
    "M5-GATE"
   ]
  },
  {
   "id": "M7",
   "name": "M7 — API/ABI Stabilization and Release Candidate",
   "outcome": "Public APIs, QPack/runtime/capability ABIs, SemVer behavior, migration rules, publishing automation, and RC canaries are stable.",
   "gate": "M7-GATE",
   "depends_on": [
    "M6-GATE"
   ]
  },
  {
   "id": "M8",
   "name": "M8 — Production-Ready GA Gate",
   "outcome": "All technical and owner gates are closed, signed reproducible artifacts are released, operations and rollback are documented, and the production-readiness review is approved.",
   "gate": "M8-GATE",
   "depends_on": [
    "M7-GATE"
   ]
  }
 ],
 "tasks": [
  {
   "id": "BASE-001",
   "milestone": "BASE",
   "lane": "critical-path",
   "priority": "P0",
   "title": "Freeze the reviewed source baseline",
   "objective": "Bind all future work to the exact reviewed archive and a real Git commit.",
   "depends_on": [],
   "deliverables": [
    "SOURCE-BASELINE.md",
    "SOURCE-COMMIT.txt",
    "baseline git bundle or patch series"
   ],
   "acceptance": [
    "SOURCE-BASELINE.md records archive name, SHA-256, source commit, toolchain locks, and known M2.3-r1 gaps.",
    "A git bundle or repository commit is available; later review never relies only on an unversioned ZIP."
   ],
   "evidence": [
    "SOURCE-BASELINE.md",
    "git rev-parse output",
    "SHA256SUMS.txt"
   ],
   "files_hint": [],
   "owner": "implementation-agent",
   "status": "PASS",
   "evidence_refs": {
    "commit": "cb881d24686dd244d26ed78145a42af7962b17fc",
    "source": [
     "docs/production/BASELINE_AND_SCOPE.md"
    ],
    "rawEvidence": [
     "SOURCE-BASELINE.md",
     "SOURCE-COMMIT.txt"
    ],
    "report": [
     "SOURCE-BASELINE.md"
    ],
    "tests": [
     "scripts/validate-production-plan"
    ]
   }
  },
  {
   "id": "BASE-002",
   "milestone": "BASE",
   "lane": "critical-path",
   "priority": "P0",
   "title": "Adopt ADR-0019 production-readiness program",
   "objective": "Extend ADR-0018 through technical production candidate, RC, and GA without changing the minimal-core thesis.",
   "depends_on": [
    "BASE-001"
   ],
   "deliverables": [],
   "acceptance": [
    "ADR-0019 is accepted and indexed.",
    "The roadmap explicitly separates technical production readiness from public GA owner decisions.",
    "Non-goals remain Node compatibility, hostile-code sandboxing, ORM-in-core, and unauthorized WebSocket/SSE work."
   ],
   "evidence": [
    "ADR file",
    "decision index link",
    "OKF validation"
   ],
   "files_hint": [],
   "owner": "implementation-agent",
   "status": "PASS",
   "evidence_refs": {
    "commit": "cb881d24686dd244d26ed78145a42af7962b17fc",
    "source": [
     "docs/okf/decisions/0019-production-readiness-program.md",
     "docs/production/ROADMAP.md"
    ],
    "rawEvidence": [
     "docs/okf/decisions/index.md"
    ],
    "report": [
     "docs/okf/decisions/0019-production-readiness-program.md"
    ],
    "tests": [
     "scripts/validate-okf"
    ]
   }
  },
  {
   "id": "BASE-003",
   "milestone": "BASE",
   "lane": "critical-path",
   "priority": "P0",
   "title": "Install the production master agent prompt",
   "objective": "Give one coding agent authority to execute the full ordered program while preserving stop conditions and owner boundaries.",
   "depends_on": [
    "BASE-002"
   ],
   "deliverables": [],
   "acceptance": [
    "AGENTS.md points to the new master prompt.",
    "The former M2/M4 stop language is superseded unambiguously.",
    "The agent may continue milestone-to-milestone only after local gates pass."
   ],
   "evidence": [
    "MASTER_PRODUCTION_AGENT_PROMPT.md",
    "AGENTS.md diff"
   ],
   "files_hint": [],
   "owner": "implementation-agent",
   "status": "PASS",
   "evidence_refs": {
    "commit": "cb881d24686dd244d26ed78145a42af7962b17fc",
    "source": [
     "AGENTS.md"
    ],
    "rawEvidence": [
     "AGENTS.md"
    ],
    "report": [
     "docs/okf/MASTER_PRODUCTION_AGENT_PROMPT.md"
    ],
    "tests": [
     "scripts/validate-okf"
    ]
   }
  },
  {
   "id": "BASE-004",
   "milestone": "BASE",
   "lane": "critical-path",
   "priority": "P0",
   "title": "Create machine-readable task and evidence ledgers",
   "objective": "Make status, dependencies, claims, tests, reports, and artifacts auditable by tools and the final reviewer.",
   "depends_on": [
    "BASE-003"
   ],
   "deliverables": [],
   "acceptance": [
    "TASKS.json validates against its schema.",
    "Every task has acceptance and evidence fields.",
    "Every completed claim links to source/test/raw evidence rather than prose alone."
   ],
   "evidence": [
    "TASKS.json",
    "TASKS.schema.json",
    "EVIDENCE_INDEX.json schema"
   ],
   "files_hint": [],
   "owner": "implementation-agent",
   "status": "PASS",
   "evidence_refs": {
    "commit": "cb881d24686dd244d26ed78145a42af7962b17fc",
    "source": [
     "docs/production/TASKS.schema.json",
     "TASKS.production.json"
    ],
    "rawEvidence": [
     "TASKS.production.json"
    ],
    "report": [
     "docs/production/TASKS.md"
    ],
    "tests": [
     "scripts/validate-production-plan"
    ]
   }
  },
  {
   "id": "BASE-005",
   "milestone": "BASE",
   "lane": "critical-path",
   "priority": "P0",
   "title": "Strengthen source-to-evidence verification",
   "objective": "Prevent reports from claiming code, tests, or benchmark results absent from the packaged source.",
   "depends_on": [
    "BASE-004"
   ],
   "deliverables": [],
   "acceptance": [
    "verify fails stale generated reports, absent named tests, duplicate current-verification sections, and mismatched artifact hashes.",
    "Benchmark summaries are generated from raw data.",
    "Test counts come from captured runner output, not manual arithmetic."
   ],
   "evidence": [
    "verify output",
    "negative fixtures",
    "generated report hash comparison"
   ],
   "files_hint": [],
   "owner": "implementation-agent",
   "status": "PASS",
   "evidence_refs": {
    "commit": "cb881d24686dd244d26ed78145a42af7962b17fc",
    "source": [
     "scripts/verify",
     "scripts/generate-benchmark-reports.py",
     "scripts/generate-conformance-report.py"
    ],
    "rawEvidence": [